kernel_benchmark/main_res.csv
M,K,N,SplitK,Sparsity,Kernel,Duration(ns),TFLOPS
8192,8192,8,7,50,SpInfer,2421163008.0,0.00044
8192,8192,8,7,50,cuBLAS_TC,2600133632.0,0.00041
8192,8192,8,7,50,Flash-LLM,2507492352.0,0.00043
8192,29568,8,7,50,SpInfer,1265551.4,3.06233
8192,29568,8,7,50,cuBLAS_TC,1031905.3,3.75571
8192,29568,8,7,50,Flash-LLM,956037.2,4.05375
